qId,qTextArr,qSpan,qText,speaker,addressee,qType,refExp,menTexts,menSpans,menEnts
Q1185,['What you come over here for?'],"[[150496, 150524]]",What you come over here for?,An Old Man,['Jake Barnes'],Implicit,,[['you']],"[[[150501, 150504]]]",[[['Jake Barnes']]]
Q1186,"[""We're going to the fiesta at Pamplona.""]","[[150528, 150566]]",We're going to the fiesta at Pamplona.,Jake Barnes,['An Old Man'],Implicit,,[['We']],"[[[150528, 150530]]]","[[['Jake Barnes', 'Bill Gorton']]]"
Q1187,['You like the bull-fights?'],"[[150570, 150595]]",You like the bull-fights?,An Old Man,['Jake Barnes'],Implicit,,[['You']],"[[[150570, 150573]]]",[[['Jake Barnes']]]
Q1188,"[""Sure. Don't you?""]","[[150599, 150615]]",Sure. Don't you?,Jake Barnes,['An Old Man'],Implicit,,[['you']],"[[[150611, 150614]]]",[[['An Old Man']]]
Q1189,"['Yes,', 'I guess I like them.']","[[150619, 150623], [150635, 150655]]","Yes, I guess I like them.",An Old Man,['Jake Barnes'],Anaphoric,he said,"[[], []]","[[], []]","[[], []]"
Q1190,['Where you go now?'],"[[150681, 150698]]",Where you go now?,An Old Man,['Jake Barnes'],Implicit,,[['you']],"[[[150687, 150690]]]",[[['Jake Barnes']]]
Q1191,['Up to Burguete to fish.'],"[[150702, 150725]]",Up to Burguete to fish.,Jake Barnes,['An Old Man'],Implicit,,[[]],[[]],[[]]
Q1192,"['Well,', 'I hope you catch something.']","[[150729, 150734], [150746, 150773]]","Well, I hope you catch something.",An Old Man,['Jake Barnes'],Anaphoric,he said,"[[], ['you']]","[[], [[150753, 150756]]]","[[], [['Jake Barnes']]]"
Q1193,"[""There's Roncevaux,""]","[[152433, 152451]]","There's Roncevaux,",Jake Barnes,['Bill Gorton'],Anaphoric,I said,[[]],[[]],[[]]
Q1194,['Where?'],"[[152463, 152469]]",Where?,Bill Gorton,['Jake Barnes'],Implicit,,[[]],[[]],[[]]
Q1195,['Way off there where the mountain starts.'],"[[152473, 152513]]",Way off there where the mountain starts.,Jake Barnes,['Bill Gorton'],Implicit,,[[]],[[]],[[]]
Q1196,"[""It's cold up here,""]","[[152517, 152535]]","It's cold up here,",Bill Gorton,['Jake Barnes'],Explicit,Bill said,[[]],[[]],[[]]
Q1197,"[""It's high,"", 'It must be twelve hundred metres.']","[[152550, 152560], [152571, 152604]]","It's high, It must be twelve hundred metres.",Jake Barnes,['Bill Gorton'],Anaphoric,I said,"[[], []]","[[], []]","[[], []]"
Q1198,"[""It's awful cold,""]","[[152608, 152624]]","It's awful cold,",Bill Gorton,['Jake Barnes'],Explicit,Bill said,[[]],[[]],[[]]
Q1199,"[""What's in there?""]","[[153061, 153077]]",What's in there?,A Carabineer In His Cocked Hat,"['Jake Barnes', 'Bill Gorton']",Anaphoric,he pointed,[[]],[[]],[[]]
Q1200,['Is that all right?'],"[[153238, 153256]]",Is that all right?,Jake Barnes,"['Bill Gorton', 'A Carabineer In His Cocked Hat']",Anaphoric,I asked,[[]],[[]],[[]]
Q1201,['Yes. Of course.'],"[[153269, 153284]]",Yes. Of course.,A Carabineer In His Cocked Hat,"['Jake Barnes', 'Bill Gorton']",Implicit,,[[]],[[]],[[]]
Q1202,"['My God!', ""It can't be this cold to-morrow. I'm not going to\nwade a stream in this weather.""]","[[154078, 154085], [154099, 154179]]","My God! It can't be this cold to-morrow. I'm not going to
wade a stream in this weather.",Bill Gorton,['Jake Barnes'],Explicit,said Bill,"[[], []]","[[], []]","[[], []]"
Q1203,"['I got to keep warm,']","[[154306, 154325]]","I got to keep warm,",Bill Gorton,['Jake Barnes'],Anaphoric,he said,[[]],[[]],[[]]
Q1204,['Twelve pesetas.'],"[[154472, 154487]]",Twelve pesetas.,The Woman Who Ran The Inn,['Jake Barnes'],Implicit,,[[]],[[]],[[]]
Q1205,"['Why, we only paid that in Pamplona.']","[[154491, 154526]]","Why, we only paid that in Pamplona.",Jake Barnes,['The Woman Who Ran The Inn'],Implicit,,[['we']],"[[[154496, 154498]]]","[[['Jake Barnes', 'Bill Gorton']]]"
Q1206,"[""That's too much,"", ""We didn't pay more than that at a big\nhotel.""]","[[154612, 154628], [154639, 154683]]","That's too much, We didn't pay more than that at a big
hotel.",Jake Barnes,['The Woman Who Ran The Inn'],Anaphoric,I said,"[[], ['We']]","[[], [[154639, 154641]]]","[[], [['Jake Barnes', 'Bill Gorton']]]"
Q1207,"[""We've put in a bathroom.""]","[[154687, 154711]]",We've put in a bathroom.,The Woman Who Ran The Inn,['Jake Barnes'],Implicit,,[[]],[[]],[[]]
Q1208,"[""Haven't you got anything cheaper?""]","[[154715, 154748]]",Haven't you got anything cheaper?,Jake Barnes,['The Woman Who Ran The Inn'],Implicit,,[['you']],"[[[154723, 154726]]]",[[['The Woman Who Ran The Inn']]]
Q1209,['Not in the summer. Now is the big season.'],"[[154752, 154793]]",Not in the summer. Now is the big season.,The Woman Who Ran The Inn,['Jake Barnes'],Implicit,,[[]],[[]],[[]]
Q1210,['Is the wine included?'],"[[154873, 154894]]",Is the wine included?,Jake Barnes,['The Woman Who Ran The Inn'],Implicit,,[[]],[[]],[[]]
Q1211,"['Oh, yes.']","[[154898, 154906]]","Oh, yes.",The Woman Who Ran The Inn,['Jake Barnes'],Implicit,,[[]],[[]],[[]]
Q1212,"['Well,', ""It's all right.""]","[[154910, 154915], [154926, 154941]]","Well, It's all right.",Jake Barnes,['The Woman Who Ran The Inn'],Anaphoric,I said,"[[], []]","[[], []]","[[], []]"
Q1213,"['How about a hot rum punch?', ""This isn't going to keep me warm permanently.""]","[[155336, 155362], [155374, 155419]]",How about a hot rum punch? This isn't going to keep me warm permanently.,Bill Gorton,['Jake Barnes'],Anaphoric,he said,"[[], []]","[[], []]","[[], []]"
Q1214,"[""There isn't too much rum in that.""]","[[155652, 155685]]",There isn't too much rum in that.,Bill Gorton,['Jake Barnes'],Implicit,,[[]],[[]],[[]]
Q1215,"['Direct action,', 'It beats legislation.']","[[155792, 155806], [155820, 155841]]","Direct action, It beats legislation.",Bill Gorton,['Jake Barnes'],Explicit,said Bill,"[[], []]","[[], []]","[[], []]"
Q1216,"['It blows like hell up here,']","[[155894, 155921]]","It blows like hell up here,",Bill Gorton,['Jake Barnes'],Explicit,Bill said,[[]],[[]],[[]]
Q1217,"['I saw you out of the window,', ""Didn't want to interrupt you.\nWhat were you doing? Burying your money?""]","[[157970, 157998], [158010, 158080]]","I saw you out of the window, Didn't want to interrupt you.
What were you doing? Burying your money?",Bill Gorton,['Jake Barnes'],Anaphoric,he said,"[['you'], ['you', 'you', 'your']]","[[[157976, 157979]], [[158035, 158038], [158050, 158053], [158069, 158073]]]","[[['Jake Barnes']], [['Jake Barnes'], ['Jake Barnes'], ['Jake Barnes']]]"
Q1218,['You lazy bum!'],"[[158084, 158097]]",You lazy bum!,Jake Barnes,['Bill Gorton'],Implicit,,[['You lazy bum']],"[[[158084, 158096]]]",[[['Bill Gorton']]]
Q1219,['Been working for the common good? Splendid. I want you to do that every\nmorning.'],"[[158101, 158181]]","Been working for the common good? Splendid. I want you to do that every
morning.",Bill Gorton,['Jake Barnes'],Implicit,,[[]],[[]],[[]]
Q1220,"['Come on,', 'Get up.']","[[158185, 158193], [158204, 158211]]","Come on, Get up.",Jake Barnes,['Bill Gorton'],Anaphoric,I said,"[[], []]","[[], []]","[[], []]"
Q1221,['What? Get up? I never get up.'],"[[158215, 158244]]",What? Get up? I never get up.,Bill Gorton,['Jake Barnes'],Implicit,,[[]],[[]],[[]]
Q1222,['Try and argue me into getting up.'],"[[158306, 158339]]",Try and argue me into getting up.,Bill Gorton,['Jake Barnes'],Implicit,,[[]],[[]],[[]]
Q1223,"[""Aren't you interested?""]","[[158424, 158446]]",Aren't you interested?,Bill Gorton,['Jake Barnes'],Explicit,Bill asked,[['you']],"[[[158431, 158434]]]",[[['Jake Barnes']]]
Q1224,"[""I'm going down and eat.""]","[[158462, 158485]]",I'm going down and eat.,Jake Barnes,['Bill Gorton'],Implicit,,[[]],[[]],[[]]
Q1225,"[""Eat? Why didn't you say eat? I thought you just wanted me to get up for\nfun. Eat? Fine. Now you're reasonable. You go out and dig some more\nworms and I'll be right down.""]","[[158489, 158658]]","Eat? Why didn't you say eat? I thought you just wanted me to get up for
fun. Eat? Fine. Now you're reasonable. You go out and dig some more
worms and I'll be right down.",Bill Gorton,['Jake Barnes'],Implicit,,"[['you', 'you', 'you', 'You']]","[[[158505, 158508], [158528, 158531], [158581, 158584], [158600, 158603]]]","[[['Jake Barnes'], ['Jake Barnes'], ['Jake Barnes'], ['Jake Barnes']]]"
Q1226,"['Oh, go to hell!']","[[158662, 158677]]","Oh, go to hell!",Jake Barnes,['Bill Gorton'],Implicit,,[[]],[[]],[[]]
Q1227,['Work for the good of all.'],"[[158681, 158706]]",Work for the good of all.,Bill Gorton,['Jake Barnes'],Implicit,,[[]],[[]],[[]]
Q1228,['Show\nirony and pity.'],"[[158745, 158765]]","Show
irony and pity.",Bill Gorton,['Jake Barnes'],Implicit,,[[]],[[]],[[]]
Q1229,['Hey! come back!'],"[[158845, 158860]]",Hey! come back!,Bill Gorton,['Jake Barnes'],Implicit,,[[]],[[]],[[]]
Q1230,"[""Aren't you going to show a little irony and pity?""]","[[158892, 158941]]",Aren't you going to show a little irony and pity?,Bill Gorton,['Jake Barnes'],Implicit,,[['you']],"[[[158899, 158902]]]",[[['Jake Barnes']]]
Q1231,"[""That's not irony.""]","[[158965, 158982]]",That's not irony.,Bill Gorton,['Jake Barnes'],Implicit,,[[]],[[]],[[]]
Q1232,"[""Irony and Pity. When you're\nfeeling . . . Oh, Give them Irony and Give them Pity. Oh, give them\nIrony. When they're feeling . . . Just a little irony. Just a little\npity . . .""]","[[159030, 159205]]","Irony and Pity. When you're
feeling . . . Oh, Give them Irony and Give them Pity. Oh, give them
Irony. When they're feeling . . . Just a little irony. Just a little
pity . . .",Bill Gorton,['Jake Barnes'],Explicit,Bill singing,[[]],[[]],[[]]
Q1233,"[""What's all this irony and pity?""]","[[159352, 159383]]",What's all this irony and pity?,Jake Barnes,['Bill Gorton'],Implicit,,[[]],[[]],[[]]
Q1234,"[""What? Don't you know about Irony and Pity?""]","[[159387, 159429]]",What? Don't you know about Irony and Pity?,Bill Gorton,['Jake Barnes'],Implicit,,[['you']],"[[[159399, 159402]]]",[[['Jake Barnes']]]
Q1235,['No. Who got it up?'],"[[159433, 159451]]",No. Who got it up?,Jake Barnes,['Bill Gorton'],Implicit,,[[]],[[]],[[]]
Q1236,"[""Everybody. They're mad about it in New York. It's just like the\nFratellinis used to be.""]","[[159455, 159542]]","Everybody. They're mad about it in New York. It's just like the
Fratellinis used to be.",Bill Gorton,['Jake Barnes'],Implicit,,[[]],[[]],[[]]
Q1237,"[""Ask her if she's got any jam,"", 'Be ironical with her.']","[[159647, 159676], [159690, 159711]]","Ask her if she's got any jam, Be ironical with her.",Bill Gorton,['Jake Barnes'],Explicit,Bill said,"[[], []]","[[], []]","[[], []]"
Q1238,['Have you got any jam?'],"[[159715, 159736]]",Have you got any jam?,Jake Barnes,['Bill Gorton'],Implicit,,[[]],[[]],[[]]
Q1239,"[""That's not ironical. I wish I could talk Spanish.""]","[[159740, 159789]]",That's not ironical. I wish I could talk Spanish.,Bill Gorton,['Jake Barnes'],Implicit,,[[]],[[]],[[]]
Q1240,['Thank you.'],"[[159899, 159909]]",Thank you.,Jake Barnes,['Bill Gorton'],Implicit,,[[]],[[]],[[]]
Q1241,"[""Hey! that's not the way,"", 'Say something ironical. Make some\ncrack about Primo de Rivera.']","[[159913, 159937], [159951, 160013]]","Hey! that's not the way, Say something ironical. Make some
crack about Primo de Rivera.",Bill Gorton,['Jake Barnes'],Explicit,Bill said,"[[], []]","[[], []]","[[], []]"
Q1242,"[""I could ask her what kind of a jam they think they've gotten into in\nthe Riff.""]","[[160017, 160095]]","I could ask her what kind of a jam they think they've gotten into in
the Riff.",Jake Barnes,['Bill Gorton'],Implicit,,[[]],[[]],[[]]
Q1243,"['Poor,', ""Very poor. You can't do it. That's all. You don't\nunderstand irony. You have no pity. Say something pitiful.""]","[[160099, 160104], [160118, 160226]]","Poor, Very poor. You can't do it. That's all. You don't
understand irony. You have no pity. Say something pitiful.",Bill Gorton,['Jake Barnes'],Explicit,said Bill,"[[], ['You', 'You', 'You']]","[[], [[160129, 160132], [160158, 160161], [160186, 160189]]]","[[], [['Jake Barnes'], ['Jake Barnes'], ['Jake Barnes']]]"
Q1244,['Robert Cohn.'],"[[160230, 160242]]",Robert Cohn.,Jake Barnes,['Bill Gorton'],Implicit,,[['Robert Cohn']],"[[[160230, 160241]]]",[[['Robert Cohn']]]
Q1245,"[""Not so bad. That's better. Now why is Cohn pitiful? Be ironic.""]","[[160246, 160308]]",Not so bad. That's better. Now why is Cohn pitiful? Be ironic.,Bill Gorton,['Jake Barnes'],Implicit,,[['Cohn']],"[[[160284, 160288]]]",[[['Robert Cohn']]]
Q1246,"['Aw, hell!', ""It's too early in the morning.""]","[[160343, 160352], [160363, 160393]]","Aw, hell! It's too early in the morning.",Jake Barnes,['Bill Gorton'],Anaphoric,I said,"[[], []]","[[], []]","[[], []]"
Q1247,"[""There you go. And you claim you want to be a writer, too. You're only a\nnewspaper man. An expatriated newspaper man. You ought to be ironical\nthe minute you get out of bed. You ought to wake up with your mouth full\nof pity.""]","[[160397, 160620]]","There you go. And you claim you want to be a writer, too. You're only a
newspaper man. An expatriated newspaper man. You ought to be ironical
the minute you get out of bed. You ought to wake up with your mouth full
of pity.",Bill Gorton,['Jake Barnes'],Implicit,,"[['you', 'you', 'you', 'You', 'You', 'you', 'You', 'your']]","[[[160403, 160406], [160415, 160418], [160425, 160428], [160455, 160458], [160514, 160517], [160550, 160553], [160570, 160573], [160596, 160600]]]","[[['Jake Barnes'], ['Jake Barnes'], ['Jake Barnes'], ['Jake Barnes'], ['Jake Barnes'], ['Jake Barnes'], ['Jake Barnes'], ['Jake Barnes']]]"
Q1248,"['Go on,', 'Who did you get this stuff from?']","[[160624, 160630], [160641, 160673]]","Go on, Who did you get this stuff from?",Jake Barnes,['Bill Gorton'],Anaphoric,I said,"[[], ['you']]","[[], [[160649, 160652]]]","[[], [['Bill Gorton']]]"
Q1249,"[""Everybody. Don't you read? Don't you ever see anybody? You know what\nyou are? You're an expatriate. Why don't you live in New York? Then\nyou'd know these things. What do you want me to do? Come over here and\ntell you every year?""]","[[160677, 160905]]","Everybody. Don't you read? Don't you ever see anybody? You know what
you are? You're an expatriate. Why don't you live in New York? Then
you'd know these things. What do you want me to do? Come over here and
tell you every year?",Bill Gorton,['Jake Barnes'],Implicit,,"[['you', 'you', 'You', 'you', 'You', 'you', 'you', 'you', 'you']]","[[[160694, 160697], [160710, 160713], [160732, 160735], [160746, 160749], [160755, 160758], [160787, 160790], [160814, 160817], [160847, 160850], [160890, 160893]]]","[[['Jake Barnes'], ['Jake Barnes'], ['Jake Barnes'], ['Jake Barnes'], ['Jake Barnes'], ['Jake Barnes'], ['Jake Barnes'], ['Jake Barnes'], ['Jake Barnes']]]"
Q1250,"['Take some more coffee,']","[[160909, 160931]]","Take some more coffee,",Jake Barnes,['Bill Gorton'],Anaphoric,I said,[[]],[[]],[[]]
Q1251,"[""Good. Coffee is good for you. It's the caffeine in it. Caffeine, we are\nhere. Caffeine puts a man on her horse and a woman in his grave. You\nknow what's the trouble with you? You're an expatriate. One of the worst\ntype. Haven't you heard that? Nobody that ever left their own country\never wrote anything worth printing. Not even in the newspapers.""]","[[160943, 161290]]","Good. Coffee is good for you. It's the caffeine in it. Caffeine, we are
here. Caffeine puts a man on her horse and a woman in his grave. You
know what's the trouble with you? You're an expatriate. One of the worst
type. Haven't you heard that? Nobody that ever left their own country
ever wrote anything worth printing. Not even in the newspapers.",Bill Gorton,['Jake Barnes'],Implicit,,"[['you', 'You', 'you', 'You', 'you']]","[[[160968, 160971], [161080, 161083], [161113, 161116], [161118, 161121], [161171, 161174]]]","[[['Jake Barnes'], ['Jake Barnes'], ['Jake Barnes'], ['Jake Barnes'], ['Jake Barnes']]]"
Q1252,"[""You're an expatriate. You've lost touch with the soil. You get\nprecious. Fake European standards have ruined you. You drink yourself to\ndeath. You become obsessed by sex. You spend all your time talking, not\nworking. You are an expatriate, see? You hang around caf s.""]","[[161316, 161583]]","You're an expatriate. You've lost touch with the soil. You get
precious. Fake European standards have ruined you. You drink yourself to
death. You become obsessed by sex. You spend all your time talking, not
working. You are an expatriate, see? You hang around caf s.",Bill Gorton,['Jake Barnes'],Implicit,,"[['You', 'You', 'You', 'you', 'You', 'You', 'You', 'your', 'You', 'You']]","[[[161316, 161319], [161338, 161341], [161371, 161374], [161425, 161428], [161430, 161433], [161459, 161462], [161487, 161490], [161501, 161505], [161533, 161536], [161561, 161564]]]","[[['Jake Barnes'], ['Jake Barnes'], ['Jake Barnes'], ['Jake Barnes'], ['Jake Barnes'], ['Jake Barnes'], ['Jake Barnes'], ['Jake Barnes'], ['Jake Barnes'], ['Jake Barnes']]]"
Q1253,"['It sounds like a swell life,', 'When do I work?']","[[161587, 161615], [161626, 161641]]","It sounds like a swell life, When do I work?",Jake Barnes,['Bill Gorton'],Anaphoric,I said,"[[], []]","[[], []]","[[], []]"
Q1254,"[""You don't work. One group claims women support you. Another group\nclaims you're impotent.""]","[[161645, 161734]]","You don't work. One group claims women support you. Another group
claims you're impotent.",Bill Gorton,['Jake Barnes'],Implicit,,"[['You', 'you', 'you']]","[[[161645, 161648], [161692, 161695], [161718, 161721]]]","[[['Jake Barnes'], ['Jake Barnes'], ['Jake Barnes']]]"
Q1255,"['No,', 'I just had an accident.']","[[161738, 161741], [161752, 161775]]","No, I just had an accident.",Jake Barnes,['Bill Gorton'],Anaphoric,I said,"[[], []]","[[], []]","[[], []]"
Q1256,"['Never mention that,', ""That's the sort of thing that can't be\nspoken of. That's what you ought to work up into a mystery. Like Henry's\nbicycle.""]","[[161779, 161798], [161812, 161932]]","Never mention that, That's the sort of thing that can't be
spoken of. That's what you ought to work up into a mystery. Like Henry's
bicycle.",Bill Gorton,['Jake Barnes'],Explicit,Bill said,"[[], ['you']]","[[], [[161874, 161877]]]","[[], [['Jake Barnes']]]"
Q1257,"[""It wasn't a bicycle,"", 'He was riding horseback.']","[[162089, 162109], [162120, 162144]]","It wasn't a bicycle, He was riding horseback.",Jake Barnes,['Bill Gorton'],Anaphoric,I said,"[[], []]","[[], []]","[[], []]"
Q1258,['I heard it was a tricycle.'],"[[162148, 162174]]",I heard it was a tricycle.,Bill Gorton,['Jake Barnes'],Implicit,,[[]],[[]],[[]]
Q1259,"['Well,', 'A plane is sort of like a tricycle. The joystick works\nthe same way.']","[[162178, 162183], [162194, 162262]]","Well, A plane is sort of like a tricycle. The joystick works
the same way.",Jake Barnes,['Bill Gorton'],Anaphoric,I said,"[[], []]","[[], []]","[[], []]"
Q1260,"[""But you don't pedal it.""]","[[162266, 162289]]",But you don't pedal it.,Bill Gorton,['Jake Barnes'],Implicit,,[[]],[[]],[[]]
Q1261,"['No,', ""I guess you don't pedal it.""]","[[162293, 162296], [162307, 162334]]","No, I guess you don't pedal it.",Jake Barnes,['Bill Gorton'],Anaphoric,I said,"[[], []]","[[], []]","[[], []]"
Q1262,"[""Let's lay off that,""]","[[162338, 162357]]","Let's lay off that,",Bill Gorton,['Jake Barnes'],Explicit,Bill said,"[[""'s""]]","[[[162341, 162343]]]","[[['Jake Barnes', 'Bill Gorton']]]"
Q1263,['All right. I was just standing up for the tricycle.'],"[[162372, 162423]]",All right. I was just standing up for the tricycle.,Jake Barnes,['Bill Gorton'],Implicit,,[[]],[[]],[[]]
Q1264,"[""I think he's a good writer, too,"", ""And you're a hell of a\ngood guy. Anybody ever tell you you were a good guy?""]","[[162427, 162459], [162473, 162548]]","I think he's a good writer, too, And you're a hell of a
good guy. Anybody ever tell you you were a good guy?",Bill Gorton,['Jake Barnes'],Explicit,Bill said,"[[], ['you', 'you', 'you']]","[[], [[162477, 162480], [162524, 162527], [162528, 162531]]]","[[], [['Jake Barnes'], ['Jake Barnes'], ['Jake Barnes']]]"
Q1265,"[""I'm not a good guy.""]","[[162552, 162571]]",I'm not a good guy.,Jake Barnes,['Bill Gorton'],Implicit,,[[]],[[]],[[]]
Q1266,"[""Listen. You're a hell of a good guy, and I'm fonder of you than anybody\non earth. I couldn't tell you that in New York. It'd mean I was a\nfaggot. That was what the Civil War was about. Abraham Lincoln was a\nfaggot. He was in love with General Grant. So was Jefferson Davis.\nLincoln just freed the slaves on a bet. The Dred Scott case was framed\nby the Anti-Saloon League. Sex explains it all. The Colonel's Lady and\nJudy O'Grady are Lesbians under their skin.""]","[[162575, 163034]]","Listen. You're a hell of a good guy, and I'm fonder of you than anybody
on earth. I couldn't tell you that in New York. It'd mean I was a
faggot. That was what the Civil War was about. Abraham Lincoln was a
faggot. He was in love with General Grant. So was Jefferson Davis.
Lincoln just freed the slaves on a bet. The Dred Scott case was framed
by the Anti-Saloon League. Sex explains it all. The Colonel's Lady and
Judy O'Grady are Lesbians under their skin.",Bill Gorton,['Jake Barnes'],Implicit,,"[['You', 'you', 'you']]","[[[162583, 162586], [162630, 162633], [162673, 162676]]]","[[['Jake Barnes'], ['Jake Barnes'], ['Jake Barnes']]]"
Q1267,['Want to hear some more?'],"[[163051, 163074]]",Want to hear some more?,Bill Gorton,['Jake Barnes'],Implicit,,[[]],[[]],[[]]
Q1268,"['Shoot,']","[[163078, 163084]]","Shoot,",Jake Barnes,['Bill Gorton'],Anaphoric,I said,[[]],[[]],[[]]
Q1269,"[""I don't know any more. Tell you some more at lunch.""]","[[163096, 163147]]",I don't know any more. Tell you some more at lunch.,Bill Gorton,['Jake Barnes'],Implicit,,[['you']],"[[[163124, 163127]]]",[[['Jake Barnes']]]
Q1270,"['Old Bill,']","[[163151, 163160]]","Old Bill,",Jake Barnes,['Bill Gorton'],Anaphoric,I said,[['Old Bill']],"[[[163151, 163159]]]",[[['Bill Gorton']]]
Q1271,['You bum!'],"[[163172, 163180]]",You bum!,Bill Gorton,['Jake Barnes'],Implicit,,[['You bum']],"[[[163172, 163179]]]",[[['Jake Barnes']]]
Q1272,"['This is country,']","[[164730, 164746]]","This is country,",Bill Gorton,['Jake Barnes'],Explicit,Bill said,[[]],[[]],[[]]
Q1273,"['We have to follow this road along the ridge, cross these hills, go\nthrough the woods on the far hills, and come down to the Irati valley,']","[[165509, 165646]]","We have to follow this road along the ridge, cross these hills, go
through the woods on the far hills, and come down to the Irati valley,",Jake Barnes,['Bill Gorton'],Anaphoric,I pointed out to Bill,[['We']],"[[[165509, 165511]]]","[[['Jake Barnes', 'Bill Gorton']]]"
Q1274,"[""That's a hell of a hike.""]","[[165673, 165697]]",That's a hell of a hike.,Bill Gorton,['Jake Barnes'],Implicit,,[[]],[[]],[[]]
Q1275,"[""It's too far to go and fish and come back the same day, comfortably.""]","[[165701, 165769]]","It's too far to go and fish and come back the same day, comfortably.",Jake Barnes,['Bill Gorton'],Implicit,,[[]],[[]],[[]]
Q1276,"[""Comfortably. That's a nice word. We'll have to go like hell to get\nthere and back and have any fishing at all.""]","[[165773, 165883]]","Comfortably. That's a nice word. We'll have to go like hell to get
there and back and have any fishing at all.",Bill Gorton,['Jake Barnes'],Implicit,,[['We']],"[[[165806, 165808]]]","[[['Jake Barnes', 'Bill Gorton']]]"
Q1277,"[""You're sure this thing has trout in it?""]","[[166505, 166544]]",You're sure this thing has trout in it?,Bill Gorton,['Jake Barnes'],Explicit,Bill asked,[['You']],"[[[166505, 166508]]]",[[['Jake Barnes']]]
Q1278,"[""It's full of them.""]","[[166560, 166578]]",It's full of them.,Jake Barnes,['Bill Gorton'],Implicit,,[[]],[[]],[[]]
Q1279,"[""I'm going to fish a fly. You got any McGintys?""]","[[166582, 166628]]",I'm going to fish a fly. You got any McGintys?,Bill Gorton,['Jake Barnes'],Implicit,,[['You']],"[[[166607, 166610]]]",[[['Jake Barnes']]]
Q1280,"[""There's some in there.""]","[[166632, 166654]]",There's some in there.,Jake Barnes,['Bill Gorton'],Implicit,,[[]],[[]],[[]]
Q1281,['You going to fish bait?'],"[[166658, 166681]]",You going to fish bait?,Bill Gorton,['Jake Barnes'],Implicit,,[['You']],"[[[166658, 166661]]]",[[['Jake Barnes']]]
Q1282,"[""Yeah. I'm going to fish the dam here.""]","[[166685, 166722]]",Yeah. I'm going to fish the dam here.,Jake Barnes,['Bill Gorton'],Implicit,,[[]],[[]],[[]]
Q1283,"[""Well, I'll take the fly-book, then.""]","[[166726, 166761]]","Well, I'll take the fly-book, then.",Bill Gorton,['Jake Barnes'],Implicit,,[[]],[[]],[[]]
Q1284,"[""Where'd I\nbetter go? Up or down?""]","[[166782, 166814]]","Where'd I
better go? Up or down?",Bill Gorton,['Jake Barnes'],Implicit,,[[]],[[]],[[]]
Q1285,"[""Down is the best. They're plenty up above, too.""]","[[166818, 166865]]","Down is the best. They're plenty up above, too.",Jake Barnes,['Bill Gorton'],Implicit,,[[]],[[]],[[]]
Q1286,['Take a worm can.'],"[[166895, 166911]]",Take a worm can.,Jake Barnes,['Bill Gorton'],Implicit,,[[]],[[]],[[]]
Q1287,"[""No, I don't want one. If they won't take a fly I'll just flick it\naround.""]","[[166915, 166988]]","No, I don't want one. If they won't take a fly I'll just flick it
around.",Bill Gorton,['Jake Barnes'],Implicit,,[[]],[[]],[[]]
Q1288,"['Say,', 'How about putting the\nwine in that spring up the road?']","[[167034, 167038], [167084, 167138]]","Say, How about putting the
wine in that spring up the road?",Bill Gorton,['Jake Barnes'],Anaphoric,he called,"[[], []]","[[], []]","[[], []]"
Q1289,"['All right,']","[[167142, 167152]]","All right,",Jake Barnes,['Bill Gorton'],Anaphoric,I shouted,[[]],[[]],[[]]
Q1290,['Get any?'],"[[170194, 170202]]",Get any?,Bill Gorton,['Jake Barnes'],Anaphoric,he asked,[[]],[[]],[[]]
Q1291,['Six. What did you get?'],"[[170356, 170378]]",Six. What did you get?,Jake Barnes,['Bill Gorton'],Implicit,,[[]],[[]],[[]]
Q1292,['How are yours?'],"[[170598, 170612]]",How are yours?,Bill Gorton,['Jake Barnes'],Implicit,,[['yours']],"[[[170606, 170611]]]",[[['Jake Barnes']]]
