qId,qTextArr,qSpan,qText,speaker,addressee,qType,refExp,menTexts,menSpans,menEnts
Q1883,['Tell him Brett wants to come into----'],"[[255771, 255808]]",Tell him Brett wants to come into----,Mike Campbell,"['Jake Barnes', 'Brett Ashley', 'Bill Gorton', 'Robert Cohn']",Implicit,,"[['him', 'Brett ']]","[[[255776, 255779], [255780, 255786]]]","[[['Pedro Romero'], ['Brett Ashley']]]"
Q1884,"[""Oh, pipe down, Mike, for Christ's sake!""]","[[255812, 255851]]","Oh, pipe down, Mike, for Christ's sake!",Brett Ashley,"['Jake Barnes', 'Mike Campbell', 'Bill Gorton', 'Robert Cohn']",Implicit,,[['Mike']],"[[[255827, 255831]]]",[[['Mike Campbell']]]
Q1885,"['Pipe down! I know that,']","[[255881, 255904]]","Pipe down! I know that,",Pedro Romero,"['Jake Barnes', 'Mike Campbell', 'Bill Gorton', 'Brett Ashley', 'Robert Cohn', 'Rafael Romero']",Anaphoric,he said,[[]],[[]],[[]]
Q1886,"[""Let's all drink to--"", 'Pedro Romero,']","[[256227, 256247], [256260, 256273]]","Let's all drink to-- Pedro Romero,",Mike Campbell,"['Jake Barnes', 'Bill Gorton', 'Brett Ashley', 'Pedro Romero', 'Robert Cohn', 'Rafael Romero']",Anaphoric,he began,"[[""'s""], ['Pedro Romero']]","[[[256230, 256232]], [[256260, 256272]]]","[[['Jake Barnes', 'Bill Gorton', 'Brett Ashley', 'Pedro Romero', 'Robert Cohn', 'Rafael Romero']], [['Pedro Romero']]]"
Q1887,"[""My God! he's a lovely boy,"", 'And how I would love to see\nhim get into those clothes. He must use a shoe-horn.']","[[256609, 256635], [256650, 256730]]","My God! he's a lovely boy, And how I would love to see
him get into those clothes. He must use a shoe-horn.",Brett Ashley,"['Jake Barnes', 'Mike Campbell', 'Bill Gorton', 'Robert Cohn']",Explicit,Brett said,"[['he'], ['him', 'He']]","[[[256617, 256619]], [[256678, 256681], [256706, 256708]]]","[[['Pedro Romero']], [['Pedro Romero'], ['Pedro Romero']]]"
Q1888,"['I started to tell him,', 'And Jake kept interrupting me. Why\ndo you interrupt me? Do you think you talk Spanish better than I do?']","[[256734, 256756], [256771, 256874]]","I started to tell him, And Jake kept interrupting me. Why
do you interrupt me? Do you think you talk Spanish better than I do?",Mike Campbell,"['Jake Barnes', 'Brett Ashley', 'Bill Gorton', 'Robert Cohn']",Explicit,Mike began,"[['him'], ['Jake ', 'you', 'you', 'you']]","[[[256752, 256755]], [[256775, 256780], [256809, 256812], [256830, 256833], [256840, 256843]]]","[[['Pedro Romero']], [['Jake Barnes'], ['Jake Barnes'], ['Jake Barnes'], ['Jake Barnes']]]"
Q1889,"['Oh, shut up, Mike! Nobody interrupted you.']","[[256878, 256920]]","Oh, shut up, Mike! Nobody interrupted you.",Robert Cohn,"['Jake Barnes', 'Mike Campbell', 'Brett Ashley', 'Bill Gorton']",Implicit,,"[['Mike', 'you']]","[[[256891, 256895], [256916, 256919]]]","[[['Mike Campbell'], ['Mike Campbell']]]"
Q1890,"[""No, I'd like to get this settled.""]","[[256924, 256957]]","No, I'd like to get this settled.",Mike Campbell,"['Jake Barnes', 'Brett Ashley', 'Bill Gorton', 'Robert Cohn']",Implicit,,[[]],[[]],[[]]
Q1891,"[""Do you\nthink you amount to something, Cohn? Do you think you belong here among\nus? People who are out to have a good time? For God's sake don't be so\nnoisy, Cohn!""]","[[256984, 257146]]","Do you
think you amount to something, Cohn? Do you think you belong here among
us? People who are out to have a good time? For God's sake don't be so
noisy, Cohn!",Mike Campbell,"['Jake Barnes', 'Brett Ashley', 'Bill Gorton', 'Robert Cohn']",Implicit,,"[['you', 'you', 'Cohn', 'you', 'you', 'us', 'Cohn']]","[[[256987, 256990], [256997, 257000], [257022, 257026], [257031, 257034], [257041, 257044], [257063, 257065], [257141, 257145]]]","[[['Robert Cohn'], ['Robert Cohn'], ['Robert Cohn'], ['Robert Cohn'], ['Robert Cohn'], ['Jake Barnes', 'Mike Campbell', 'Bill Gorton'], ['Robert Cohn']]]"
Q1892,"['Oh, cut it out, Mike,']","[[257150, 257171]]","Oh, cut it out, Mike,",Robert Cohn,"['Jake Barnes', 'Mike Campbell', 'Brett Ashley', 'Bill Gorton']",Explicit,Cohn said,[['Mike']],"[[[257166, 257170]]]",[[['Mike Campbell']]]
Q1893,"[""Do you think Brett wants you here? Do you think you add to the party?\nWhy don't you say something?""]","[[257186, 257284]]","Do you think Brett wants you here? Do you think you add to the party?
Why don't you say something?",Mike Campbell,"['Jake Barnes', 'Brett Ashley', 'Bill Gorton', 'Robert Cohn']",Implicit,,"[['you', 'Brett ', 'you', 'you', 'you', 'the party', 'you']]","[[[257189, 257192], [257199, 257205], [257211, 257214], [257224, 257227], [257234, 257237], [257245, 257254], [257266, 257269]]]","[[['Robert Cohn'], ['Brett Ashley'], ['Robert Cohn'], ['Robert Cohn'], ['Robert Cohn'], ['Bill Gorton', 'Jake Barnes', 'Mike Campbell'], ['Robert Cohn']]]"
Q1894,"['I said all I had to say the other night, Mike.']","[[257288, 257334]]","I said all I had to say the other night, Mike.",Robert Cohn,"['Jake Barnes', 'Mike Campbell', 'Brett Ashley', 'Bill Gorton']",Implicit,,[['Mike']],"[[[257329, 257333]]]",[[['Mike Campbell']]]
Q1895,"[""I'm not one of you literary chaps.""]","[[257338, 257372]]",I'm not one of you literary chaps.,Mike Campbell,"['Jake Barnes', 'Brett Ashley', 'Bill Gorton', 'Robert Cohn']",Implicit,,[['you literary chaps']],"[[[257353, 257371]]]","[[['Jake Barnes', 'Bill Gorton']]]"
Q1896,"[""I'm not clever. But I do know when I'm not wanted.\nWhy don't you see when you're not wanted, Cohn? Go away. Go away, for\nGod's sake. Take that sad Jewish face away. Don't you think I'm right?""]","[[257424, 257615]]","I'm not clever. But I do know when I'm not wanted.
Why don't you see when you're not wanted, Cohn? Go away. Go away, for
God's sake. Take that sad Jewish face away. Don't you think I'm right?",Mike Campbell,"['Jake Barnes', 'Brett Ashley', 'Bill Gorton', 'Robert Cohn']",Implicit,,"[['you', 'you', 'Cohn']]","[[[257485, 257488], [257498, 257501], [257517, 257521]]]","[[['Robert Cohn'], ['Robert Cohn'], ['Robert Cohn']]]"
Q1897,"['Sure,', ""Let's all go over to the Iru a.""]","[[257637, 257642], [257653, 257684]]","Sure, Let's all go over to the Iru a.",Jake Barnes,"['Mike Campbell', 'Brett Ashley', 'Bill Gorton', 'Robert Cohn']",Anaphoric,I said,"[[], [""'s""]]","[[], [[257656, 257658]]]","[[], [['Jake Barnes', 'Brett Ashley', 'Bill Gorton', 'Robert Cohn']]]"
Q1898,"[""No. Don't you think I'm right? I love that woman.""]","[[257688, 257737]]",No. Don't you think I'm right? I love that woman.,Mike Campbell,"['Jake Barnes', 'Brett Ashley', 'Bill Gorton', 'Robert Cohn']",Implicit,,"[['you', 'that woman']]","[[[257698, 257701], [257726, 257736]]]","[[['Jake Barnes'], ['Brett Ashley']]]"
Q1899,"[""Oh, don't start that again. Do shove it along, Michael,""]","[[257741, 257796]]","Oh, don't start that again. Do shove it along, Michael,",Brett Ashley,"['Jake Barnes', 'Mike Campbell', 'Bill Gorton', 'Robert Cohn']",Explicit,Brett said,[['Michael']],"[[[257788, 257795]]]",[[['Mike Campbell']]]
Q1900,"[""Don't you think I'm right, Jake?""]","[[257812, 257844]]","Don't you think I'm right, Jake?",Mike Campbell,"['Jake Barnes', 'Brett Ashley', 'Bill Gorton', 'Robert Cohn']",Implicit,,"[['you', 'Jake']]","[[[257818, 257821], [257839, 257843]]]","[[['Jake Barnes'], ['Jake Barnes']]]"
Q1901,"['Jake,', ""You know I'm right. Listen,\nyou!""]","[[258062, 258067], [258103, 258135]]","Jake, You know I'm right. Listen,
you!",Mike Campbell,"['Jake Barnes', 'Brett Ashley', 'Bill Gorton', 'Robert Cohn']",Explicit,Mike said,"[['Jake'], ['You']]","[[[258062, 258066]], [[258103, 258106]]]","[[['Jake Barnes']], [['Jake Barnes']]]"
Q1902,['Go away! Go away now!'],"[[258157, 258178]]",Go away! Go away now!,Mike Campbell,"['Jake Barnes', 'Brett Ashley', 'Bill Gorton', 'Robert Cohn']",Anaphoric,He turned to Cohn,[[]],[[]],[[]]
Q1903,"[""But I won't go, Mike,""]","[[258182, 258203]]","But I won't go, Mike,",Robert Cohn,"['Jake Barnes', 'Mike Campbell', 'Brett Ashley', 'Bill Gorton']",Explicit,said Cohn,[['Mike']],"[[[258198, 258202]]]",[[['Mike Campbell']]]
Q1904,"[""Then I'll make you!""]","[[258218, 258237]]",Then I'll make you!,Mike Campbell,"['Jake Barnes', 'Brett Ashley', 'Bill Gorton', 'Robert Cohn']",Implicit,,[['you']],"[[[258233, 258236]]]",[[['Robert Cohn']]]
Q1905,"['Come on to the caf ,', ""You can't hit him here\nin the hotel.""]","[[258478, 258498], [258509, 258545]]","Come on to the caf , You can't hit him here
in the hotel.",Jake Barnes,"['Mike Campbell', 'Brett Ashley', 'Bill Gorton', 'Robert Cohn']",Anaphoric,I said,"[[], ['You', 'him']]","[[], [[258509, 258512], [258523, 258526]]]","[[], [['Mike Campbell'], ['Robert Cohn']]]"
Q1906,"['Good!', 'Good idea!']","[[258549, 258554], [258568, 258578]]",Good! Good idea!,Mike Campbell,"['Jake Barnes', 'Brett Ashley', 'Bill Gorton', 'Robert Cohn']",Explicit,said Mike,"[[], []]","[[], []]","[[], []]"
Q1907,"[""They're razzing Don Manuel,""]","[[259959, 259986]]","They're razzing Don Manuel,",Bill Gorton,"['Jake Barnes', 'Mike Campbell', 'Brett Ashley', 'Robert Cohn']",Explicit,Bill said,[[]],[[]],[[]]
Q1908,"[""How do you know he's Don Manuel?""]","[[260001, 260033]]",How do you know he's Don Manuel?,Brett Ashley,"['Jake Barnes', 'Mike Campbell', 'Bill Gorton', 'Robert Cohn']",Explicit,Brett said,[['you']],"[[[260008, 260011]]]",[[['Bill Gorton']]]
Q1909,"[""His name's on the programme. Don Manuel Orquito, the pirotecnico of\nesta ciudad.""]","[[260049, 260129]]","His name's on the programme. Don Manuel Orquito, the pirotecnico of
esta ciudad.",Bill Gorton,"['Jake Barnes', 'Mike Campbell', 'Brett Ashley', 'Robert Cohn']",Implicit,,[[]],[[]],[[]]
Q1910,"['Globos illuminados,', ""A collection of globos illuminados.\nThat's what the paper said.""]","[[260133, 260152], [260166, 260229]]","Globos illuminados, A collection of globos illuminados.
That's what the paper said.",Mike Campbell,"['Jake Barnes', 'Brett Ashley', 'Bill Gorton', 'Robert Cohn']",Explicit,Mike said,"[[], []]","[[], []]","[[], []]"
Q1911,"['I say, I wish one would go up,', 'That Don Manuel chap is\nfurious.']","[[260269, 260299], [260314, 260346]]","I say, I wish one would go up, That Don Manuel chap is
furious.",Brett Ashley,"['Jake Barnes', 'Mike Campbell', 'Bill Gorton', 'Robert Cohn']",Explicit,Brett said,"[[], []]","[[], []]","[[], []]"
Q1912,"[""He's probably worked for weeks fixing them to go off, spelling out\n'Hail to San Fermin,'""]","[[260350, 260438]]","He's probably worked for weeks fixing them to go off, spelling out
'Hail to San Fermin,'",Bill Gorton,"['Jake Barnes', 'Mike Campbell', 'Brett Ashley', 'Robert Cohn']",Explicit,Bill said,[[]],[[]],[[]]
Q1913,"['Globos illuminados,', 'A bunch of bloody globos illuminados.']","[[260453, 260472], [260486, 260523]]","Globos illuminados, A bunch of bloody globos illuminados.",Mike Campbell,"['Jake Barnes', 'Brett Ashley', 'Bill Gorton', 'Robert Cohn']",Explicit,Mike said,"[[], []]","[[], []]","[[], []]"
Q1914,"['Come on,', ""We can't stand here.""]","[[260527, 260535], [260550, 260570]]","Come on, We can't stand here.",Brett Ashley,"['Jake Barnes', 'Mike Campbell', 'Bill Gorton', 'Robert Cohn']",Explicit,said Brett,"[[], ['We']]","[[], [[260550, 260552]]]","[[], [['Jake Barnes', 'Mike Campbell', 'Bill Gorton', 'Brett Ashley', 'Robert Cohn']]]"
Q1915,"['Her ladyship wants a drink,']","[[260574, 260601]]","Her ladyship wants a drink,",Mike Campbell,"['Jake Barnes', 'Brett Ashley', 'Bill Gorton', 'Robert Cohn']",Explicit,Mike said,[['Her ladyship']],"[[[260574, 260586]]]",[[['Brett Ashley']]]
Q1916,"['How you know things,']","[[260616, 260636]]","How you know things,",Brett Ashley,"['Jake Barnes', 'Mike Campbell', 'Bill Gorton', 'Robert Cohn']",Explicit,Brett said,[['you']],"[[[260620, 260623]]]",[[['Mike Campbell']]]
Q1917,"[""Come on, let's get out of here,""]","[[260786, 260817]]","Come on, let's get out of here,",Bill Gorton,"['Jake Barnes', 'Mike Campbell', 'Brett Ashley', 'Robert Cohn']",Explicit,Bill said,"[[""'s""]]","[[[260798, 260800]]]","[[['Jake Barnes', 'Mike Campbell', 'Bill Gorton', 'Brett Ashley', 'Robert Cohn']]]"
Q1918,"[""Here's the pub,""]","[[261209, 261224]]","Here's the pub,",Mike Campbell,"['Jake Barnes', 'Edna', 'Bill Gorton', 'Brett Ashley', 'Robert Cohn']",Explicit,Mike said,[[]],[[]],[[]]
Q1919,"['This is a hell of a place,']","[[261457, 261483]]","This is a hell of a place,",Bill Gorton,"['Jake Barnes', 'Mike Campbell', 'Edna', 'Brett Ashley', 'Robert Cohn']",Explicit,Bill said,[[]],[[]],[[]]
Q1920,"[""It's too early.""]","[[261498, 261513]]",It's too early.,Jake Barnes,"['Edna', 'Mike Campbell', 'Bill Gorton', 'Brett Ashley', 'Robert Cohn']",Implicit,,[[]],[[]],[[]]
Q1921,"[""Let's take the bottle and come back later,"", ""I don't want to\nsit here on a night like this.""]","[[261517, 261559], [261573, 261619]]","Let's take the bottle and come back later, I don't want to
sit here on a night like this.",Bill Gorton,"['Jake Barnes', 'Mike Campbell', 'Edna', 'Brett Ashley', 'Robert Cohn']",Explicit,Bill said,"[[""'s""], []]","[[[261520, 261522]], []]","[[['Jake Barnes', 'Mike Campbell', 'Bill Gorton', 'Brett Ashley', 'Robert Cohn']], []]"
Q1922,"[""Let's go and look at the English,"", 'I love to look at the\nEnglish.']","[[261623, 261656], [261670, 261700]]","Let's go and look at the English, I love to look at the
English.",Mike Campbell,"['Jake Barnes', 'Edna', 'Bill Gorton', 'Brett Ashley', 'Robert Cohn']",Explicit,Mike said,"[[""'s""], []]","[[[261626, 261628]], []]","[[['Jake Barnes', 'Mike Campbell', 'Bill Gorton', 'Brett Ashley', 'Robert Cohn']], []]"
Q1923,"[""They're awful,"", 'Where did they all come from?']","[[261704, 261718], [261732, 261761]]","They're awful, Where did they all come from?",Bill Gorton,"['Jake Barnes', 'Mike Campbell', 'Edna', 'Brett Ashley', 'Robert Cohn']",Explicit,Bill said,"[[], []]","[[], []]","[[], []]"
Q1924,"['They come from Biarritz,', 'They come to see the last day of\nthe quaint little Spanish fiesta.']","[[261765, 261789], [261803, 261869]]","They come from Biarritz, They come to see the last day of
the quaint little Spanish fiesta.",Mike Campbell,"['Jake Barnes', 'Edna', 'Bill Gorton', 'Brett Ashley', 'Robert Cohn']",Explicit,Mike said,"[[], []]","[[], []]","[[], []]"
Q1925,"[""I'll festa them,""]","[[261873, 261889]]","I'll festa them,",Bill Gorton,"['Jake Barnes', 'Mike Campbell', 'Edna', 'Brett Ashley', 'Robert Cohn']",Explicit,Bill said,[[]],[[]],[[]]
Q1926,"[""You're an extraordinarily beautiful girl.""]","[[261904, 261945]]",You're an extraordinarily beautiful girl.,Mike Campbell,"['Jake Barnes', 'Edna', 'Bill Gorton', 'Brett Ashley', 'Robert Cohn']",Implicit,,[['You']],"[[[261904, 261907]]]",[[['Edna']]]
Q1927,['When did you come here?'],"[[261978, 262001]]",When did you come here?,Mike Campbell,"['Jake Barnes', 'Edna', 'Bill Gorton', 'Brett Ashley', 'Robert Cohn']",Implicit,,[['you']],"[[[261987, 261990]]]",[[['Edna']]]
Q1928,"['Come off it, Michael.']","[[262005, 262026]]","Come off it, Michael.",Brett Ashley,"['Jake Barnes', 'Mike Campbell', 'Edna', 'Bill Gorton', 'Robert Cohn']",Implicit,,[['Michael']],"[[[262018, 262025]]]",[[['Mike Campbell']]]
Q1929,"[""I say, she _is_ a lovely girl. Where have I been? Where have I been\nlooking all this while? You're a lovely thing. _Have_ we met? Come along\nwith me and Bill. We're going to festa the English.""]","[[262030, 262222]]","I say, she _is_ a lovely girl. Where have I been? Where have I been
looking all this while? You're a lovely thing. _Have_ we met? Come along
with me and Bill. We're going to festa the English.",Mike Campbell,"['Jake Barnes', 'Edna', 'Bill Gorton', 'Brett Ashley', 'Robert Cohn']",Implicit,,"[['she', 'You', 'we', 'Bill', 'We']]","[[[262037, 262040], [262122, 262125], [262152, 262154], [262183, 262187], [262189, 262191]]]","[[['Edna'], ['Edna'], ['Edna', 'Mike Campbell'], ['Bill Gorton'], ['Bill Gorton', 'Mike Campbell']]]"
Q1930,"[""I'll festa them,"", 'What the hell are they doing at this\nfiesta?']","[[262226, 262242], [262256, 262300]]","I'll festa them, What the hell are they doing at this
fiesta?",Bill Gorton,"['Jake Barnes', 'Mike Campbell', 'Edna', 'Brett Ashley', 'Robert Cohn']",Explicit,Bill said,"[[], []]","[[], []]","[[], []]"
Q1931,"['Come on,', ""Just us three. We're going to festa the bloody\nEnglish. I hope you're not English? I'm Scotch. I hate the English. I'm\ngoing to festa them. Come on, Bill.""]","[[262304, 262312], [262326, 262480]]","Come on, Just us three. We're going to festa the bloody
English. I hope you're not English? I'm Scotch. I hate the English. I'm
going to festa them. Come on, Bill.",Mike Campbell,"['Jake Barnes', 'Edna', 'Bill Gorton', 'Brett Ashley', 'Robert Cohn']",Explicit,Mike said,"[[], ['us', 'We', 'you', 'Bill']]","[[], [[262331, 262333], [262341, 262343], [262389, 262392], [262475, 262479]]]","[[], [['Edna', 'Mike Campbell', 'Bill Gorton'], ['Edna', 'Mike Campbell', 'Bill Gorton'], ['Edna'], ['Bill Gorton']]]"
Q1932,"[""I'm going to sit here,""]","[[262599, 262621]]","I'm going to sit here,",Brett Ashley,"['Jake Barnes', 'Robert Cohn']",Explicit,Brett said,[[]],[[]],[[]]
Q1933,"[""I'll stay with you,""]","[[262637, 262656]]","I'll stay with you,",Robert Cohn,"['Jake Barnes', 'Brett Ashley']",Explicit,Cohn said,[['you']],"[[[262652, 262655]]]",[[['Brett Ashley']]]
Q1934,"[""Oh, don't!"", ""For God's sake, go off somewhere. Can't you\nsee Jake and I want to talk?""]","[[262671, 262681], [262696, 262768]]","Oh, don't! For God's sake, go off somewhere. Can't you
see Jake and I want to talk?",Brett Ashley,"['Jake Barnes', 'Robert Cohn']",Explicit,Brett said,"[[], ['you', 'Jake ']]","[[], [[262736, 262739], [262744, 262749]]]","[[], [['Robert Cohn'], ['Jake Barnes']]]"
Q1935,"[""I didn't,"", ""I thought I'd sit here because I felt a little\ntight.""]","[[262772, 262781], [262795, 262848]]","I didn't, I thought I'd sit here because I felt a little
tight.",Robert Cohn,"['Jake Barnes', 'Brett Ashley']",Explicit,Cohn said,"[[], []]","[[], []]","[[], []]"
Q1936,"[""What a hell of a reason for sitting with any one. If you're tight, go\nto bed. Go on to bed.""]","[[262852, 262943]]","What a hell of a reason for sitting with any one. If you're tight, go
to bed. Go on to bed.",Brett Ashley,"['Jake Barnes', 'Robert Cohn']",Implicit,,[['you']],"[[[262905, 262908]]]",[[['Robert Cohn']]]
Q1937,"['Was I rude enough to him?', ""My God! I'm so\nsick of him!""]","[[262947, 262972], [263003, 263030]]","Was I rude enough to him? My God! I'm so
sick of him!",Brett Ashley,['Jake Barnes'],Explicit,Brett asked,"[['him'], ['him']]","[[[262968, 262971]], [[263026, 263029]]]","[[['Robert Cohn']], [['Robert Cohn']]]"
Q1938,"[""He doesn't add much to the gayety.""]","[[263034, 263068]]",He doesn't add much to the gayety.,Jake Barnes,['Brett Ashley'],Implicit,,[['He']],"[[[263034, 263036]]]",[[['Robert Cohn']]]
Q1939,['He depresses me so.'],"[[263072, 263091]]",He depresses me so.,Brett Ashley,['Jake Barnes'],Implicit,,[['He']],"[[[263072, 263074]]]",[[['Robert Cohn']]]
Q1940,"[""He's behaved very badly.""]","[[263095, 263119]]",He's behaved very badly.,Jake Barnes,['Brett Ashley'],Implicit,,[['He']],"[[[263095, 263097]]]",[[['Robert Cohn']]]
Q1941,['Damned badly. He had a chance to behave so well.'],"[[263123, 263171]]",Damned badly. He had a chance to behave so well.,Brett Ashley,['Jake Barnes'],Implicit,,[['He']],"[[[263137, 263139]]]",[[['Robert Cohn']]]
Q1942,"[""He's probably waiting just outside the door now.""]","[[263175, 263223]]",He's probably waiting just outside the door now.,Jake Barnes,['Brett Ashley'],Implicit,,[['He']],"[[[263175, 263177]]]",[[['Robert Cohn']]]
Q1943,"[""Yes. He would. You know I do know how he feels. He can't believe it\ndidn't mean anything.""]","[[263227, 263316]]","Yes. He would. You know I do know how he feels. He can't believe it
didn't mean anything.",Brett Ashley,['Jake Barnes'],Implicit,,"[['He', 'You', 'he', 'He']]","[[[263232, 263234], [263242, 263245], [263265, 263267], [263275, 263277]]]","[[['Robert Cohn'], ['Jake Barnes'], ['Robert Cohn'], ['Robert Cohn']]]"
Q1944,['I know.'],"[[263320, 263327]]",I know.,Jake Barnes,['Brett Ashley'],Implicit,,[[]],[[]],[[]]
Q1945,"[""Nobody else would behave as badly. Oh, I'm so sick of the whole thing.\nAnd Michael. Michael's been lovely, too.""]","[[263331, 263442]]","Nobody else would behave as badly. Oh, I'm so sick of the whole thing.
And Michael. Michael's been lovely, too.",Brett Ashley,['Jake Barnes'],Implicit,,"[['Michael', 'Michael']]","[[[263406, 263413], [263415, 263422]]]","[[['Mike Campbell'], ['Mike Campbell']]]"
Q1946,"[""It's been damned hard on Mike.""]","[[263446, 263476]]",It's been damned hard on Mike.,Jake Barnes,['Brett Ashley'],Implicit,,[['Mike']],"[[[263471, 263475]]]",[[['Mike Campbell']]]
Q1947,"[""Yes. But he didn't need to be a swine.""]","[[263480, 263518]]",Yes. But he didn't need to be a swine.,Brett Ashley,['Jake Barnes'],Implicit,,[[]],[[]],[[]]
Q1948,"['Everybody behaves badly,', 'Give them the proper chance.']","[[263522, 263546], [263557, 263585]]","Everybody behaves badly, Give them the proper chance.",Jake Barnes,['Brett Ashley'],Anaphoric,I said,"[[], []]","[[], []]","[[], []]"
Q1949,"[""You wouldn't behave badly.""]","[[263589, 263615]]",You wouldn't behave badly.,Brett Ashley,['Jake Barnes'],Explicit,Brett looked at me,[['You']],"[[[263589, 263592]]]",[[['Jake Barnes']]]
Q1950,"[""I'd be as big an ass as Cohn,""]","[[263639, 263668]]","I'd be as big an ass as Cohn,",Jake Barnes,['Brett Ashley'],Anaphoric,I said,[['Cohn']],"[[[263663, 263667]]]",[[['Robert Cohn']]]
Q1951,"[""Darling, don't let's talk a lot of rot.""]","[[263680, 263719]]","Darling, don't let's talk a lot of rot.",Brett Ashley,['Jake Barnes'],Implicit,,"[['Darling', ""'s""]]","[[[263680, 263687], [263698, 263700]]]","[[['Jake Barnes'], ['Jake Barnes', 'Brett Ashley']]]"
Q1952,['All right. Talk about anything you like.'],"[[263723, 263763]]",All right. Talk about anything you like.,Jake Barnes,['Brett Ashley'],Implicit,,[[]],[[]],[[]]
Q1953,"[""Don't be difficult. You're the only person I've got, and I feel rather\nawful to-night.""]","[[263767, 263853]]","Don't be difficult. You're the only person I've got, and I feel rather
awful to-night.",Brett Ashley,['Jake Barnes'],Implicit,,[['You']],"[[[263787, 263790]]]",[[['Jake Barnes']]]
Q1954,"[""You've got Mike.""]","[[263857, 263873]]",You've got Mike.,Jake Barnes,['Brett Ashley'],Implicit,,"[['You', 'Mike']]","[[[263857, 263860], [263868, 263872]]]","[[['Brett Ashley'], ['Mike Campbell']]]"
Q1955,"[""Yes, Mike. Hasn't he been pretty?""]","[[263877, 263910]]","Yes, Mike. Hasn't he been pretty?",Brett Ashley,['Jake Barnes'],Implicit,,"[['Mike', 'he']]","[[[263882, 263886], [263895, 263897]]]","[[['Mike Campbell'], ['Mike Campbell']]]"
Q1956,"['Well,', ""it's been damned hard on Mike, having Cohn around and\nseeing him with you.""]","[[263914, 263919], [263930, 264004]]","Well, it's been damned hard on Mike, having Cohn around and
seeing him with you.",Jake Barnes,['Brett Ashley'],Anaphoric,I said,"[[], ['Mike', 'Cohn ', 'him', 'you']]","[[], [[263955, 263959], [263968, 263973], [263991, 263994], [264000, 264003]]]","[[], [['Mike Campbell'], ['Robert Cohn'], ['Robert Cohn'], ['Brett Ashley']]]"
Q1957,"[""Don't I know it, darling? Please don't make me feel any worse than I\ndo.""]","[[264008, 264080]]","Don't I know it, darling? Please don't make me feel any worse than I
do.",Brett Ashley,['Jake Barnes'],Implicit,,[[]],[[]],[[]]
Q1958,"[""Let's have one more drink of that,"", 'My nerves are rotten.']","[[264302, 264336], [264351, 264372]]","Let's have one more drink of that, My nerves are rotten.",Brett Ashley,['Jake Barnes'],Explicit,Brett said,"[[""'s""], []]","[[[264305, 264307]], []]","[[['Jake Barnes', 'Brett Ashley']], []]"
Q1959,"['Come on,']","[[264433, 264441]]","Come on,",Brett Ashley,['Jake Barnes'],Explicit,said Brett,[[]],[[]],[[]]
Q1960,"['He _was_ there,']","[[264525, 264540]]","He _was_ there,",Brett Ashley,['Jake Barnes'],Explicit,Brett said,[['He']],"[[[264525, 264527]]]",[[['Robert Cohn']]]
Q1961,"[""He can't be away from you.""]","[[264556, 264582]]",He can't be away from you.,Jake Barnes,['Brett Ashley'],Implicit,,"[['He', 'you']]","[[[264556, 264558], [264578, 264581]]]","[[['Robert Cohn'], ['Brett Ashley']]]"
Q1962,['Poor devil!'],"[[264586, 264597]]",Poor devil!,Brett Ashley,['Jake Barnes'],Implicit,,[[]],[[]],[[]]
Q1963,"[""I'm not sorry for him. I hate him, myself.""]","[[264601, 264643]]","I'm not sorry for him. I hate him, myself.",Jake Barnes,['Brett Ashley'],Implicit,,"[['him', 'him']]","[[[264619, 264622], [264631, 264634]]]","[[['Robert Cohn'], ['Robert Cohn']]]"
Q1964,"['I hate him, too,', 'I hate his damned suffering.']","[[264647, 264663], [264680, 264708]]","I hate him, too, I hate his damned suffering.",Brett Ashley,['Jake Barnes'],Anaphoric,she shivered,"[['him'], ['his']]","[[[264654, 264657]], [[264687, 264690]]]","[[['Robert Cohn']], [['Robert Cohn']]]"
Q1965,"[""Don't feel bad,""]","[[265447, 265462]]","Don't feel bad,",Jake Barnes,['Brett Ashley'],Anaphoric,I said,[[]],[[]],[[]]
Q1966,"['I feel like hell,', ""Don't let's talk.""]","[[265474, 265491], [265506, 265523]]","I feel like hell, Don't let's talk.",Brett Ashley,['Jake Barnes'],Explicit,Brett said,"[[], [""'s""]]","[[], [[265515, 265517]]]","[[], [['Jake Barnes', 'Brett Ashley']]]"
Q1967,"[""It's cold.""]","[[265925, 265935]]",It's cold.,Brett Ashley,['Jake Barnes'],Implicit,,[[]],[[]],[[]]
Q1968,['Want to walk back?'],"[[265939, 265957]]",Want to walk back?,Jake Barnes,['Brett Ashley'],Implicit,,[[]],[[]],[[]]
Q1969,['Through the park.'],"[[265961, 265978]]",Through the park.,Brett Ashley,['Jake Barnes'],Implicit,,[[]],[[]],[[]]
Q1970,"['Do you still love me, Jake?']","[[266069, 266096]]","Do you still love me, Jake?",Brett Ashley,['Jake Barnes'],Implicit,,"[['you', 'Jake']]","[[[266072, 266075], [266091, 266095]]]","[[['Jake Barnes'], ['Jake Barnes']]]"
Q1971,"['Yes,']","[[266100, 266104]]","Yes,",Jake Barnes,['Brett Ashley'],Anaphoric,I said,[[]],[[]],[[]]
