qId,qTextArr,qSpan,qText,speaker,addressee,qType,refExp,menTexts,menSpans,menEnts
Q591,"[""I don't think so. I'd just _tromper_ you with everybody. You couldn't\nstand it.""]","[[77189, 77268]]","I don't think so. I'd just _tromper_ you with everybody. You couldn't
stand it.",Brett Ashley,['Jake Barnes'],Implicit,,"[['you', 'You']]","[[[77226, 77229], [77246, 77249]]]","[[['Jake Barnes'], ['Jake Barnes']]]"
Q592,['I stand it now.'],"[[77272, 77287]]",I stand it now.,Jake Barnes,['Brett Ashley'],Implicit,,[[]],[[]],[[]]
Q593,"[""That would be different. It's my fault, Jake. It's the way I'm made.""]","[[77291, 77359]]","That would be different. It's my fault, Jake. It's the way I'm made.",Brett Ashley,['Jake Barnes'],Implicit,,[['Jake']],"[[[77331, 77335]]]",[[['Jake Barnes']]]
Q594,"[""Couldn't we go off in the country for a while?""]","[[77363, 77409]]",Couldn't we go off in the country for a while?,Jake Barnes,['Brett Ashley'],Implicit,,[['we']],"[[[77372, 77374]]]","[[['Jake Barnes', 'Brett Ashley']]]"
Q595,"[""It wouldn't be any good. I'll go if you like. But I couldn't live\nquietly in the country. Not with my own true love.""]","[[77413, 77529]]","It wouldn't be any good. I'll go if you like. But I couldn't live
quietly in the country. Not with my own true love.",Brett Ashley,['Jake Barnes'],Implicit,,[['you']],"[[[77449, 77452]]]",[[['Jake Barnes']]]
Q596,['I know.'],"[[77533, 77540]]",I know.,Jake Barnes,['Brett Ashley'],Implicit,,[[]],[[]],[[]]
Q597,"[""Isn't it rotten? There isn't any use my telling you I love you.""]","[[77544, 77607]]",Isn't it rotten? There isn't any use my telling you I love you.,Brett Ashley,['Jake Barnes'],Implicit,,"[['you', 'you']]","[[[77592, 77595], [77603, 77606]]]","[[['Jake Barnes'], ['Jake Barnes']]]"
Q598,['You know I love you.'],"[[77611, 77631]]",You know I love you.,Jake Barnes,['Brett Ashley'],Implicit,,"[['You', 'you']]","[[[77611, 77614], [77627, 77630]]]","[[['Brett Ashley'], ['Brett Ashley']]]"
Q599,"[""Let's not talk. Talking's all bilge. I'm going away from you, and then\nMichael's coming back.""]","[[77635, 77728]]","Let's not talk. Talking's all bilge. I'm going away from you, and then
Michael's coming back.",Brett Ashley,['Jake Barnes'],Implicit,,"[[""'s"", 'you', 'Michael']]","[[[77638, 77640], [77692, 77695], [77706, 77713]]]","[[['Jake Barnes', 'Brett Ashley'], ['Jake Barnes'], ['Mike Campbell']]]"
Q600,['Why are you going away?'],"[[77732, 77755]]",Why are you going away?,Jake Barnes,['Brett Ashley'],Implicit,,[['you']],"[[[77740, 77743]]]",[[['Brett Ashley']]]
Q601,['Better for you. Better for me.'],"[[77759, 77789]]",Better for you. Better for me.,Brett Ashley,['Jake Barnes'],Implicit,,[['you']],"[[[77770, 77773]]]",[[['Jake Barnes']]]
Q602,['When are you going?'],"[[77793, 77812]]",When are you going?,Jake Barnes,['Brett Ashley'],Implicit,,[['you']],"[[[77802, 77805]]]",[[['Brett Ashley']]]
Q603,['Soon as I can.'],"[[77816, 77830]]",Soon as I can.,Brett Ashley,['Jake Barnes'],Implicit,,[[]],[[]],[[]]
Q604,['Where?'],"[[77834, 77840]]",Where?,Jake Barnes,['Brett Ashley'],Implicit,,[[]],[[]],[[]]
Q605,['San Sebastian.'],"[[77844, 77858]]",San Sebastian.,Brett Ashley,['Jake Barnes'],Implicit,,[[]],[[]],[[]]
Q606,"[""Can't we go together?""]","[[77862, 77883]]",Can't we go together?,Jake Barnes,['Brett Ashley'],Implicit,,[['we']],"[[[77868, 77870]]]","[[['Jake Barnes', 'Brett Ashley']]]"
Q607,"[""No. That would be a hell of an idea after we'd just talked it out.""]","[[77887, 77953]]",No. That would be a hell of an idea after we'd just talked it out.,Brett Ashley,['Jake Barnes'],Implicit,,[['we']],"[[[77929, 77931]]]","[[['Jake Barnes', 'Brett Ashley']]]"
Q608,['We never agreed.'],"[[77957, 77973]]",We never agreed.,Jake Barnes,['Brett Ashley'],Implicit,,[['We']],"[[[77957, 77959]]]","[[['Jake Barnes', 'Brett Ashley']]]"
Q609,"[""Oh, you know as well as I do. Don't be obstinate, darling.""]","[[77977, 78035]]","Oh, you know as well as I do. Don't be obstinate, darling.",Brett Ashley,['Jake Barnes'],Implicit,,"[['you', 'darling']]","[[[77981, 77984], [78027, 78034]]]","[[['Jake Barnes'], ['Jake Barnes']]]"
Q610,"['Oh, sure,', ""I know you're right. I'm just low, and when I'm low\nI talk like a fool.""]","[[78039, 78048], [78059, 78130]]","Oh, sure, I know you're right. I'm just low, and when I'm low
I talk like a fool.",Jake Barnes,['Brett Ashley'],Anaphoric,I said,"[[], ['you']]","[[], [[78066, 78069]]]","[[], [['Brett Ashley']]]"
Q611,"[""Don't look like that, darling.""]","[[78217, 78247]]","Don't look like that, darling.",Brett Ashley,['Jake Barnes'],Implicit,,[['darling']],"[[[78239, 78246]]]",[[['Jake Barnes']]]
Q612,['How do you want me to look?'],"[[78251, 78278]]",How do you want me to look?,Jake Barnes,['Brett Ashley'],Implicit,,[['you']],"[[[78258, 78261]]]",[[['Brett Ashley']]]
Q613,"[""Oh, don't be a fool. I'm going away to-morrow.""]","[[78282, 78328]]","Oh, don't be a fool. I'm going away to-morrow.",Brett Ashley,['Jake Barnes'],Implicit,,[[]],[[]],[[]]
Q614,['To-morrow?'],"[[78332, 78342]]",To-morrow?,Jake Barnes,['Brett Ashley'],Implicit,,[[]],[[]],[[]]
Q615,"[""Yes. Didn't I say so? I am.""]","[[78346, 78373]]",Yes. Didn't I say so? I am.,Brett Ashley,['Jake Barnes'],Implicit,,[[]],[[]],[[]]
Q616,"[""Let's have a drink, then. The count will be back.""]","[[78377, 78426]]","Let's have a drink, then. The count will be back.",Jake Barnes,['Brett Ashley'],Implicit,,"[[""'s"", 'The count']]","[[[78380, 78382], [78403, 78412]]]","[[['Jake Barnes', 'Brett Ashley'], ['Count Mippipopolous']]]"
Q617,"[""Yes. He should be back. You know he's extraordinary about buying\nchampagne. It means any amount to him.""]","[[78430, 78533]]","Yes. He should be back. You know he's extraordinary about buying
champagne. It means any amount to him.",Brett Ashley,['Jake Barnes'],Implicit,,"[['He', 'You', 'he', 'him']]","[[[78435, 78437], [78454, 78457], [78463, 78465], [78529, 78532]]]","[[['Count Mippipopolous'], ['Jake Barnes'], ['Count Mippipopolous'], ['Count Mippipopolous']]]"
Q618,"['Where should I have him put it, sir?']","[[78781, 78817]]","Where should I have him put it, sir?",Count Mippipopolous,"['Jake Barnes', 'Brett Ashley', 'The Chauffeur']",Anaphoric,asked the count,"[['him', 'sir']]","[[[78801, 78804], [78813, 78816]]]","[[['The Chauffeur'], ['Jake Barnes']]]"
Q619,"['In the kitchen,']","[[78838, 78853]]","In the kitchen,",Brett Ashley,"['Jake Barnes', 'Count Mippipopolous', 'The Chauffeur']",Explicit,Brett said,[[]],[[]],[[]]
Q620,"['Put it in there, Henry,', 'Now go down and get the\nice.']","[[78869, 78892], [78915, 78943]]","Put it in there, Henry, Now go down and get the
ice.",Count Mippipopolous,"['Jake Barnes', 'Brett Ashley', 'The Chauffeur']",Anaphoric,the count motioned,"[['Henry'], []]","[[[78886, 78891]], []]","[[['The Chauffeur']], []]"
Q621,"[""I\nthink you'll find that's very good wine,"", ""I know we don't get\nmuch of a chance to judge good wine in the States now, but I got this\nfrom a friend of mine that's in the business.""]","[[79005, 79047], [79059, 79194]]","I
think you'll find that's very good wine, I know we don't get
much of a chance to judge good wine in the States now, but I got this
from a friend of mine that's in the business.",Count Mippipopolous,"['Jake Barnes', 'Brett Ashley']",Anaphoric,he said,"[['you'], []]","[[[79013, 79016]], []]","[[['Jake Barnes', 'Brett Ashley']], []]"
Q622,"['Oh, you always have some one in the trade,']","[[79198, 79240]]","Oh, you always have some one in the trade,",Brett Ashley,"['Jake Barnes', 'Count Mippipopolous']",Explicit,Brett said,[['you']],"[[[79202, 79205]]]",[[['Count Mippipopolous']]]
Q623,"[""This fellow raises the grapes. He's got thousands of acres of them.""]","[[79256, 79323]]",This fellow raises the grapes. He's got thousands of acres of them.,Count Mippipopolous,"['Jake Barnes', 'Brett Ashley']",Implicit,,[[]],[[]],[[]]
Q624,"[""What's his name?"", 'Veuve Cliquot?']","[[79327, 79343], [79359, 79373]]",What's his name? Veuve Cliquot?,Brett Ashley,"['Jake Barnes', 'Count Mippipopolous']",Explicit,asked Brett,"[[], []]","[[], []]","[[], []]"
Q625,"['No,', ""Mumms. He's a baron.""]","[[79377, 79380], [79399, 79419]]","No, Mumms. He's a baron.",Count Mippipopolous,"['Jake Barnes', 'Brett Ashley']",Anaphoric,said the count,"[[], []]","[[], []]","[[], []]"
Q626,"[""Isn't it wonderful,"", ""We all have titles. Why haven't you a\ntitle, Jake?""]","[[79423, 79442], [79457, 79507]]","Isn't it wonderful, We all have titles. Why haven't you a
title, Jake?",Brett Ashley,"['Jake Barnes', 'Count Mippipopolous']",Explicit,said Brett,"[[], ['We', 'you', 'Jake']]","[[], [[79457, 79459], [79489, 79492], [79502, 79506]]]","[[], [['Count Mippipopolous', 'Brett Ashley'], ['Jake Barnes'], ['Jake Barnes']]]"
Q627,"['I assure you, sir,', 'It never does a\nman any good. Most of the time it costs you money.']","[[79511, 79529], [79566, 79632]]","I assure you, sir, It never does a
man any good. Most of the time it costs you money.",Count Mippipopolous,"['Jake Barnes', 'Brett Ashley']",Anaphoric,the count put his hand on my arm,"[['you', 'sir'], ['you']]","[[[79520, 79523], [79525, 79528]], [[79622, 79625]]]","[[['Jake Barnes'], ['Jake Barnes']], [['Jake Barnes']]]"
Q628,"[""Oh, I don't know. It's damned useful sometimes,""]","[[79636, 79683]]","Oh, I don't know. It's damned useful sometimes,",Brett Ashley,"['Jake Barnes', 'Count Mippipopolous']",Explicit,Brett said,[[]],[[]],[[]]
Q629,"[""I've never known it to do me any good.""]","[[79699, 79737]]",I've never known it to do me any good.,Count Mippipopolous,"['Jake Barnes', 'Brett Ashley']",Implicit,,[[]],[[]],[[]]
Q630,"[""You haven't used it properly. I've had hell's own amount of credit on\nmine.""]","[[79741, 79816]]","You haven't used it properly. I've had hell's own amount of credit on
mine.",Brett Ashley,"['Jake Barnes', 'Count Mippipopolous']",Implicit,,[[]],[[]],[[]]
Q631,"['Do sit down, count,', 'Let me take that stick.']","[[79820, 79839], [79850, 79873]]","Do sit down, count, Let me take that stick.",Jake Barnes,"['Count Mippipopolous', 'Brett Ashley']",Anaphoric,I said,"[['count'], []]","[[[79833, 79838]], []]","[[['Count Mippipopolous']], []]"
Q632,"[""I say, Jake, I don't want to ruin your rugs. Can't you give\na chap an ash-tray?""]","[[80031, 80110]]","I say, Jake, I don't want to ruin your rugs. Can't you give
a chap an ash-tray?",Brett Ashley,"['Jake Barnes', 'Count Mippipopolous']",Implicit,,"[['Jake', 'your', 'you']]","[[[80038, 80042], [80065, 80069], [80082, 80085]]]","[[['Jake Barnes'], ['Jake Barnes'], ['Jake Barnes']]]"
Q633,"['Put two bottles in it, Henry,']","[[80217, 80246]]","Put two bottles in it, Henry,",Count Mippipopolous,"['Jake Barnes', 'Brett Ashley', 'The Chauffeur']",Anaphoric,the count called,[['Henry']],"[[[80240, 80245]]]",[[['The Chauffeur']]]
Q634,"['Anything else, sir?']","[[80268, 80287]]","Anything else, sir?",The Chauffeur,"['Jake Barnes', 'Count Mippipopolous', 'Brett Ashley']",Implicit,,[['sir']],"[[[80283, 80286]]]",[[['Count Mippipopolous']]]
Q635,['No. Wait down in the car.'],"[[80291, 80316]]",No. Wait down in the car.,Count Mippipopolous,"['Jake Barnes', 'Brett Ashley', 'The Chauffeur']",Implicit,,[[]],[[]],[[]]
Q636,"[""We'll want to\nride out to the Bois for dinner?""]","[[80349, 80395]]","We'll want to
ride out to the Bois for dinner?",Count Mippipopolous,"['Jake Barnes', 'Brett Ashley', 'The Chauffeur']",Implicit,,[['We']],"[[[80349, 80351]]]","[[['Jake Barnes', 'Count Mippipopolous', 'Brett Ashley']]]"
Q637,"['If you like,', ""I couldn't eat a thing.""]","[[80399, 80411], [80426, 80449]]","If you like, I couldn't eat a thing.",Brett Ashley,"['Jake Barnes', 'Count Mippipopolous', 'The Chauffeur']",Explicit,Brett said,"[['you'], []]","[[[80402, 80405]], []]","[[['Count Mippipopolous']], []]"
Q638,"['I always like a good meal,']","[[80453, 80479]]","I always like a good meal,",Count Mippipopolous,"['Jake Barnes', 'Brett Ashley', 'The Chauffeur']",Anaphoric,said the count,[[]],[[]],[[]]
Q639,"['Should I bring the wine in, sir?']","[[80499, 80531]]","Should I bring the wine in, sir?",The Chauffeur,"['Jake Barnes', 'Count Mippipopolous', 'Brett Ashley']",Anaphoric,asked the chauffeur,[['sir']],"[[[80527, 80530]]]",[[['Count Mippipopolous']]]
Q640,"['Yes. Bring it in, Henry,']","[[80556, 80580]]","Yes. Bring it in, Henry,",Count Mippipopolous,"['Jake Barnes', 'Brett Ashley', 'The Chauffeur']",Anaphoric,said the count,[['Henry']],"[[[80574, 80579]]]",[[['The Chauffeur']]]
Q641,['Like to try a real American cigar?'],"[[80660, 80694]]",Like to try a real American cigar?,Count Mippipopolous,"['Jake Barnes', 'Brett Ashley']",Anaphoric,said the count,[[]],[[]],[[]]
Q642,"['Thanks,', ""I'll finish the cigarette.""]","[[80698, 80705], [80716, 80742]]","Thanks, I'll finish the cigarette.",Jake Barnes,"['Count Mippipopolous', 'Brett Ashley']",Anaphoric,I said,"[[], []]","[[], []]","[[], []]"
Q643,"['I like a cigar to really draw,', ""Half the cigars you\nsmoke don't draw.""]","[[80837, 80867], [80885, 80922]]","I like a cigar to really draw, Half the cigars you
smoke don't draw.",Count Mippipopolous,"['Jake Barnes', 'Brett Ashley']",Anaphoric,said the count,"[[], []]","[[], []]","[[], []]"
Q644,"[""And\nwhen you're divorced, Lady Ashley, then you won't have a title.""]","[[80993, 81060]]","And
when you're divorced, Lady Ashley, then you won't have a title.",Count Mippipopolous,"['Jake Barnes', 'Brett Ashley']",Implicit,,"[['you', 'Lady Ashley', 'you']]","[[[81002, 81005], [81019, 81030], [81037, 81040]]]","[[['Brett Ashley'], ['Brett Ashley'], ['Brett Ashley']]]"
Q645,['No. What a pity.'],"[[81064, 81080]]",No. What a pity.,Brett Ashley,"['Jake Barnes', 'Count Mippipopolous']",Implicit,,[[]],[[]],[[]]
Q646,"['No,', ""You don't need a title. You got class all over\nyou.""]","[[81084, 81087], [81106, 81157]]","No, You don't need a title. You got class all over
you.",Count Mippipopolous,"['Jake Barnes', 'Brett Ashley']",Anaphoric,said the count,"[[], ['You', 'You', 'you']]","[[], [[81106, 81109], [81130, 81133], [81153, 81156]]]","[[], [['Brett Ashley'], ['Brett Ashley'], ['Brett Ashley']]]"
Q647,['Thanks. Awfully decent of you.'],"[[81161, 81191]]",Thanks. Awfully decent of you.,Brett Ashley,"['Jake Barnes', 'Count Mippipopolous']",Implicit,,[['you']],"[[[81187, 81190]]]",[[['Count Mippipopolous']]]
Q648,"[""I'm not joking you,"", ""You got the most\nclass of anybody I ever seen. You got it. That's all.""]","[[81195, 81214], [81250, 81320]]","I'm not joking you, You got the most
class of anybody I ever seen. You got it. That's all.",Count Mippipopolous,"['Jake Barnes', 'Brett Ashley']",Anaphoric,the count blew a cloud of smoke,"[['you'], ['You', 'You']]","[[[81210, 81213]], [[81250, 81253], [81297, 81300]]]","[[['Brett Ashley']], [['Brett Ashley'], ['Brett Ashley']]]"
Q649,"['Nice of you,', ""Mummy would be pleased. Couldn't you write\nit out, and I'll send it in a letter to her.""]","[[81324, 81336], [81351, 81438]]","Nice of you, Mummy would be pleased. Couldn't you write
it out, and I'll send it in a letter to her.",Brett Ashley,"['Jake Barnes', 'Count Mippipopolous']",Explicit,said Brett,"[['you'], ['you']]","[[[81332, 81335]], [[81384, 81387]]]","[[['Count Mippipopolous']], [['Count Mippipopolous']]]"
Q650,"[""I'd tell her, too,"", ""I'm not joking you. I never joke\npeople. Joke people and you make enemies. That's what I always say.""]","[[81442, 81460], [81479, 81579]]","I'd tell her, too, I'm not joking you. I never joke
people. Joke people and you make enemies. That's what I always say.",Count Mippipopolous,"['Jake Barnes', 'Brett Ashley']",Anaphoric,said the count,"[['her'], ['you']]","[[[81451, 81454]], [[81494, 81497]]]","[[['Brett Ashley']], [['Brett Ashley']]]"
Q651,"[""You're right,"", ""You're terribly right. I always joke people\nand I haven't a friend in the world. Except Jake here.""]","[[81583, 81596], [81611, 81709]]","You're right, You're terribly right. I always joke people
and I haven't a friend in the world. Except Jake here.",Brett Ashley,"['Jake Barnes', 'Count Mippipopolous']",Explicit,Brett said,"[['You'], ['You', 'Jake']]","[[[81583, 81586]], [[81611, 81614], [81699, 81703]]]","[[['Count Mippipopolous']], [['Count Mippipopolous'], ['Jake Barnes']]]"
Q652,"[""You don't joke him.""]","[[81713, 81732]]",You don't joke him.,Count Mippipopolous,"['Jake Barnes', 'Brett Ashley']",Implicit,,"[['You', 'him']]","[[[81713, 81716], [81728, 81731]]]","[[['Brett Ashley'], ['Jake Barnes']]]"
Q653,"[""That's it.""]","[[81736, 81746]]",That's it.,Brett Ashley,"['Jake Barnes', 'Count Mippipopolous']",Implicit,,[[]],[[]],[[]]
Q654,"['Do you, now?', 'Do you joke him?']","[[81750, 81762], [81782, 81798]]","Do you, now? Do you joke him?",Count Mippipopolous,"['Jake Barnes', 'Brett Ashley']",Anaphoric,asked the count,"[['you'], ['you', 'him']]","[[[81753, 81756]], [[81785, 81788], [81794, 81797]]]","[[['Brett Ashley']], [['Brett Ashley'], ['Jake Barnes']]]"
Q655,"['No,', ""I wouldn't joke him.""]","[[81863, 81866], [81879, 81899]]","No, I wouldn't joke him.",Brett Ashley,"['Jake Barnes', 'Count Mippipopolous']",Anaphoric,she said,"[[], ['him']]","[[], [[81895, 81898]]]","[[], [['Jake Barnes']]]"
Q656,"['See,', ""You don't joke him.""]","[[81903, 81907], [81926, 81945]]","See, You don't joke him.",Count Mippipopolous,"['Jake Barnes', 'Brett Ashley']",Anaphoric,said the count,"[[], ['You', 'him']]","[[], [[81926, 81929], [81941, 81944]]]","[[], [['Brett Ashley'], ['Jake Barnes']]]"
Q657,"['This is a hell of a dull talk,', 'How about some of that\nchampagne?']","[[81949, 81979], [81994, 82027]]","This is a hell of a dull talk, How about some of that
champagne?",Brett Ashley,"['Jake Barnes', 'Count Mippipopolous']",Explicit,Brett said,"[[], []]","[[], []]","[[], []]"
Q658,"[""It\nisn't cold, yet. You're always drinking, my dear. Why don't you just\ntalk?""]","[[82099, 82176]]","It
isn't cold, yet. You're always drinking, my dear. Why don't you just
talk?",Count Mippipopolous,"['Jake Barnes', 'Brett Ashley']",Implicit,,"[['You', 'my dear', 'you']]","[[[82119, 82122], [82143, 82150], [82162, 82165]]]","[[['Brett Ashley'], ['Brett Ashley'], ['Brett Ashley']]]"
Q659,"[""I've talked too ruddy much. I've talked myself all out to Jake.""]","[[82180, 82243]]",I've talked too ruddy much. I've talked myself all out to Jake.,Brett Ashley,"['Jake Barnes', 'Count Mippipopolous']",Implicit,,[['Jake']],"[[[82238, 82242]]]",[[['Jake Barnes']]]
Q660,"['I should like to hear you really talk, my dear. When you talk to me you\nnever finish your sentences at all.']","[[82247, 82354]]","I should like to hear you really talk, my dear. When you talk to me you
never finish your sentences at all.",Count Mippipopolous,"['Jake Barnes', 'Brett Ashley']",Implicit,,"[['you', 'my dear', 'you', 'you', 'your']]","[[[82269, 82272], [82286, 82293], [82300, 82303], [82315, 82318], [82332, 82336]]]","[[['Brett Ashley'], ['Brett Ashley'], ['Brett Ashley'], ['Brett Ashley'], ['Brett Ashley']]]"
Q661,"[""Leave 'em for you to finish. Let any one finish them as they like.""]","[[82358, 82424]]",Leave 'em for you to finish. Let any one finish them as they like.,Brett Ashley,"['Jake Barnes', 'Count Mippipopolous']",Implicit,,[['you']],"[[[82372, 82375]]]",[[['Count Mippipopolous']]]
Q662,"['It is a very interesting system,', 'Still I would like to hear you talk some time.']","[[82428, 82460], [82516, 82562]]","It is a very interesting system, Still I would like to hear you talk some time.",Count Mippipopolous,"['Jake Barnes', 'Brett Ashley']",Anaphoric,the count reached down,"[[], ['you']]","[[], [[82543, 82546]]]","[[], [['Brett Ashley']]]"
Q663,"[""Isn't he a fool?""]","[[82566, 82582]]",Isn't he a fool?,Brett Ashley,"['Jake Barnes', 'Count Mippipopolous']",Explicit,Brett asked,[['he']],"[[[82572, 82574]]]",[[['Count Mippipopolous']]]
Q664,"['Now,', 'I think this is cool.']","[[82599, 82603], [82637, 82658]]","Now, I think this is cool.",Count Mippipopolous,"['Jake Barnes', 'Brett Ashley']",Anaphoric,the count brought up,"[[], []]","[[], []]","[[], []]"
Q665,['I like to\ndrink champagne from magnums. The wine is better but it would have been\ntoo hard to cool.'],"[[82724, 82823]]","I like to
drink champagne from magnums. The wine is better but it would have been
too hard to cool.",Count Mippipopolous,"['Jake Barnes', 'Brett Ashley']",Implicit,,[[]],[[]],[[]]
Q666,"['I say. You might open it,']","[[82885, 82910]]","I say. You might open it,",Brett Ashley,"['Jake Barnes', 'Count Mippipopolous']",Explicit,Brett suggested,[['You']],"[[[82892, 82895]]]",[[['Count Mippipopolous']]]
Q667,"[""Yes, my dear. Now I'll open it.""]","[[82931, 82962]]","Yes, my dear. Now I'll open it.",Count Mippipopolous,"['Jake Barnes', 'Brett Ashley']",Implicit,,[['my dear']],"[[[82936, 82943]]]",[[['Brett Ashley']]]
Q668,"['I say that is wine,']","[[82993, 83012]]","I say that is wine,",Brett Ashley,"['Jake Barnes', 'Count Mippipopolous']",Implicit,,[[]],[[]],[[]]
Q669,"[""We ought to toast\nsomething. 'Here's to royalty.'""]","[[83040, 83089]]","We ought to toast
something. 'Here's to royalty.'",Brett Ashley,"['Jake Barnes', 'Count Mippipopolous']",Implicit,,[['We']],"[[[83040, 83042]]]","[[['Jake Barnes', 'Count Mippipopolous', 'Brett Ashley']]]"
Q670,"[""This wine is too good for toast-drinking, my dear. You don't want to\nmix emotions up with a wine like that. You lose the taste.""]","[[83093, 83220]]","This wine is too good for toast-drinking, my dear. You don't want to
mix emotions up with a wine like that. You lose the taste.",Count Mippipopolous,"['Jake Barnes', 'Brett Ashley']",Implicit,,"[['my dear', 'You', 'You']]","[[[83135, 83142], [83144, 83147], [83201, 83204]]]","[[['Brett Ashley'], ['Brett Ashley'], ['Brett Ashley']]]"
Q671,"['You ought to write a book on wines, count,']","[[83250, 83292]]","You ought to write a book on wines, count,",Jake Barnes,"['Count Mippipopolous', 'Brett Ashley']",Anaphoric,I said,"[['You', 'count']]","[[[83250, 83253], [83286, 83291]]]","[[['Count Mippipopolous'], ['Count Mippipopolous']]]"
Q672,"['Mr. Barnes,', 'all I want out of wines is to enjoy\nthem.']","[[83304, 83315], [83338, 83379]]","Mr. Barnes, all I want out of wines is to enjoy
them.",Count Mippipopolous,"['Jake Barnes', 'Brett Ashley']",Anaphoric,answered the count,"[['Mr. Barnes'], []]","[[[83304, 83314]], []]","[[['Jake Barnes']], []]"
Q673,"[""Let's enjoy a little more of this,""]","[[83383, 83417]]","Let's enjoy a little more of this,",Brett Ashley,"['Jake Barnes', 'Count Mippipopolous']",Implicit,,"[[""'s""]]","[[[83386, 83388]]]","[[['Jake Barnes', 'Count Mippipopolous', 'Brett Ashley']]]"
Q674,"['There, my dear. Now you enjoy that slowly,\nand then you can get drunk.']","[[83485, 83555]]","There, my dear. Now you enjoy that slowly,
and then you can get drunk.",Count Mippipopolous,"['Jake Barnes', 'Brett Ashley']",Implicit,,"[['my dear', 'you', 'you']]","[[[83492, 83499], [83505, 83508], [83537, 83540]]]","[[['Brett Ashley'], ['Brett Ashley'], ['Brett Ashley']]]"
Q675,['Drunk? Drunk?'],"[[83559, 83572]]",Drunk? Drunk?,Brett Ashley,"['Jake Barnes', 'Count Mippipopolous']",Implicit,,[[]],[[]],[[]]
Q676,"['My dear, you are charming when you are drunk.']","[[83576, 83621]]","My dear, you are charming when you are drunk.",Count Mippipopolous,"['Jake Barnes', 'Brett Ashley']",Implicit,,"[['My dear', 'you', 'you']]","[[[83576, 83583], [83585, 83588], [83607, 83610]]]","[[['Brett Ashley'], ['Brett Ashley'], ['Brett Ashley']]]"
Q677,['Listen to the man.'],"[[83625, 83643]]",Listen to the man.,Brett Ashley,"['Jake Barnes', 'Count Mippipopolous']",Implicit,,[['the man']],"[[[83635, 83642]]]",[[['Count Mippipopolous']]]
Q678,"['Mr. Barnes,', 'She is the only lady I\nhave ever known who was as charming when she was drunk as when she was\nsober.']","[[83647, 83658], [83693, 83793]]","Mr. Barnes, She is the only lady I
have ever known who was as charming when she was drunk as when she was
sober.",Count Mippipopolous,"['Jake Barnes', 'Brett Ashley']",Anaphoric,the count poured,"[['Mr. Barnes'], ['She', 'she', 'she']]","[[[83647, 83657]], [[83693, 83696], [83757, 83760], [83779, 83782]]]","[[['Jake Barnes']], [['Brett Ashley'], ['Brett Ashley'], ['Brett Ashley']]]"
Q679,"[""You haven't been around much, have you?""]","[[83797, 83836]]","You haven't been around much, have you?",Brett Ashley,"['Jake Barnes', 'Count Mippipopolous']",Implicit,,"[['You', 'you']]","[[[83797, 83800], [83832, 83835]]]","[[['Count Mippipopolous'], ['Count Mippipopolous']]]"
Q680,"['Yes, my dear. I have been around very much. I have been around a very\ngreat deal.']","[[83840, 83921]]","Yes, my dear. I have been around very much. I have been around a very
great deal.",Count Mippipopolous,"['Jake Barnes', 'Brett Ashley']",Implicit,,[['my dear']],"[[[83845, 83852]]]",[[['Brett Ashley']]]
Q681,"['Drink your wine,', ""We've all been around. I dare say Jake\nhere has seen as much as you have.""]","[[83925, 83941], [83956, 84029]]","Drink your wine, We've all been around. I dare say Jake
here has seen as much as you have.",Brett Ashley,"['Jake Barnes', 'Count Mippipopolous']",Explicit,said Brett,"[['your'], ['We', 'Jake', 'you']]","[[[83931, 83935]], [[83956, 83958], [83990, 83994], [84020, 84023]]]","[[['Count Mippipopolous']], [['Brett Ashley', 'Count Mippipopolous', 'Jake Barnes'], ['Jake Barnes'], ['Count Mippipopolous']]]"
Q682,"[""My dear, I am sure Mr. Barnes has seen a lot. Don't think I don't think\nso, sir. I have seen a lot, too.""]","[[84033, 84137]]","My dear, I am sure Mr. Barnes has seen a lot. Don't think I don't think
so, sir. I have seen a lot, too.",Count Mippipopolous,"['Jake Barnes', 'Brett Ashley']",Implicit,,"[['My dear', 'Mr. Barnes', 'sir']]","[[[84033, 84040], [84052, 84062], [84109, 84112]]]","[[['Brett Ashley'], ['Jake Barnes'], ['Jake Barnes']]]"
